dmesg;
[ 4427.186751] usb 1-3.4: USB disconnect, address 5
[ 4434.080161] usb 1-3.4: new low speed USB device using ehci_hcd and address 7
[ 4434.195980] usb 1-3.4: configuration #1 chosen from 1 choice
[ 4434.199639] generic-usb 0003:1D34:0004.0006: hiddev97,hidraw2: USB HID v1.10 Device [Dream Link DL100B Dream Cheeky Generic Controller] on usb-0000:00:1a.7-3.4/input0

lsusb:
Bus 001 Device 007: ID 1d34:0004  
Device Descriptor:
  bLength                18
  bDescriptorType         1
  bcdUSB               1.10
  bDeviceClass            0 (Defined at Interface level)
  bDeviceSubClass         0 
  bDeviceProtocol         0 
  bMaxPacketSize0         8
  idVendor           0x1d34 
  idProduct          0x0004 
  bcdDevice            0.02
  iManufacturer           1 Dream Link
  iProduct                2 DL100B Dream Cheeky Generic Controller
  iSerial                 0 
  bNumConfigurations      1
  Configuration Descriptor:
    bLength                 9
    bDescriptorType         2
    wTotalLength           34
    bNumInterfaces          1
    bConfigurationValue     1
    iConfiguration          0 
    bmAttributes         0x80
      (Bus Powered)
    MaxPower              500mA
    Interface Descriptor:
      bLength                 9
      bDescriptorType         4
      bInterfaceNumber        0
      bAlternateSetting       0
      bNumEndpoints           1
      bInterfaceClass         3 Human Interface Device
      bInterfaceSubClass      0 No Subclass
      bInterfaceProtocol      0 None
      iInterface              0 
        HID Device Descriptor:
          bLength                 9
          bDescriptorType        33
          bcdHID               1.10
          bCountryCode            0 Not supported
          bNumDescriptors         1
          bDescriptorType        34 Report
          wDescriptorLength      37
         Report Descriptors: 
           ** UNAVAILABLE **
      Endpoint Descriptor:
        bLength                 7
        bDescriptorType         5
        bEndpointAddress     0x81  EP 1 IN
        bmAttributes            3
          Transfer Type            Interrupt
          Synch Type               None
          Usage Type               Data
        wMaxPacketSize     0x0008  1x 8 bytes
        bInterval              10
Device Status:     0x0000
  (Bus Powered)

