No.     Time        Source                Destination           Protocol Info
    153 102.416795  host                  5.0                   USB      GET DESCRIPTOR Request DEVICE[Packet size limited during capture]

Frame 153 (26 bytes on wire, 8 bytes captured)
    Arrival Time: Oct 10, 2010 12:56:06.846400000
    [Time delta from previous captured frame: 0.046122000 seconds]
    [Time delta from previous displayed frame: 102.416795000 seconds]
    [Time since reference or first frame: 102.416795000 seconds]
    Frame Number: 153
    Frame Length: 26 bytes
    Capture Length: 8 bytes
    [Frame is marked: True]
    [Protocols in frame: usb]
USB URB
    URB id: 0xffff88002c33bd80
    URB type: URB_SUBMIT ('S')
    URB transfer type: URB_CONTROL (2)
    Endpoint: 0x80
    Device: 5
    URB bus id: 1
    Device setup request: present (0)
    Data: not present ('<')
    URB status: Operation now in progress (-EINPROGRESS) (-115)
    URB length [bytes]: 18
    Data length [bytes]: 0
    [Response in: 154]
    [bInterfaceClass: HID (0x03)]
    URB setup
        bmRequestType: 0x80
            1... .... = Direction: Device-to-host
            .00. .... = Type: Standard (0x00)
            ...0 0000 = Recipient: Device (0x00)
        bRequest: GET DESCRIPTOR (6)
        Descriptor Index: 0x00
        bDescriptorType: DEVICE (1)
        Language Id: no language specified (0x0000)
        wLength: 18
[Packet size limited during capture: USB truncated]

No.     Time        Source                Destination           Protocol Info
    154 102.417642  5.0                   host                  USB      GET DESCRIPTOR Response DEVICE

Frame 154 (26 bytes on wire, 26 bytes captured)
    Arrival Time: Oct 10, 2010 12:56:06.847247000
    [Time delta from previous captured frame: 0.000847000 seconds]
    [Time delta from previous displayed frame: 0.000847000 seconds]
    [Time since reference or first frame: 102.417642000 seconds]
    Frame Number: 154
    Frame Length: 26 bytes
    Capture Length: 26 bytes
    [Frame is marked: False]
    [Protocols in frame: usb]
USB URB
    URB id: 0xffff88002c33bd80
    URB type: URB_COMPLETE ('C')
    URB transfer type: URB_CONTROL (2)
    Endpoint: 0x80
    Device: 5
    URB bus id: 1
    Device setup request: not present ('-')
    Data: present (0)
    URB status: Success (0)
    URB length [bytes]: 18
    Data length [bytes]: 18
    [Request in: 153]
    [Time from request: 0.000847000 seconds]
    [bInterfaceClass: HID (0x03)]
    DEVICE DESCRIPTOR
        bLength: 0
        bDescriptorType: Unknown (0)
        bcdUSB: 0x0000
        bDeviceClass: 0
        bDeviceSubClass: 0
        bDeviceProtocol: 0
        bMaxPacketSize0: 0
        idVendor: 0x0200
        idProduct: 0x0000
        bcdDevice: 0x0000
        iManufacturer: 0
        iProduct: 0
        iSerialNumber: 18
        bNumConfigurations: 1

No.     Time        Source                Destination           Protocol Info
    155 102.417702  host                  5.0                   USB      GET DESCRIPTOR Request CONFIGURATION[Packet size limited during capture]

Frame 155 (17 bytes on wire, 8 bytes captured)
    Arrival Time: Oct 10, 2010 12:56:06.847307000
    [Time delta from previous captured frame: 0.000060000 seconds]
    [Time delta from previous displayed frame: 0.000060000 seconds]
    [Time since reference or first frame: 102.417702000 seconds]
    Frame Number: 155
    Frame Length: 17 bytes
    Capture Length: 8 bytes
    [Frame is marked: False]
    [Protocols in frame: usb]
USB URB
    URB id: 0xffff88002c33bd80
    URB type: URB_SUBMIT ('S')
    URB transfer type: URB_CONTROL (2)
    Endpoint: 0x80
    Device: 5
    URB bus id: 1
    Device setup request: present (0)
    Data: not present ('<')
    URB status: Operation now in progress (-EINPROGRESS) (-115)
    URB length [bytes]: 9
    Data length [bytes]: 0
    [Response in: 156]
    [bInterfaceClass: HID (0x03)]
    URB setup
        bmRequestType: 0x80
            1... .... = Direction: Device-to-host
            .00. .... = Type: Standard (0x00)
            ...0 0000 = Recipient: Device (0x00)
        bRequest: GET DESCRIPTOR (6)
        Descriptor Index: 0x00
        bDescriptorType: CONFIGURATION (2)
        Language Id: no language specified (0x0000)
        wLength: 9
[Packet size limited during capture: USB truncated]

No.     Time        Source                Destination           Protocol Info
    156 102.418264  5.0                   host                  USB      GET DESCRIPTOR Response CONFIGURATION

Frame 156 (17 bytes on wire, 17 bytes captured)
    Arrival Time: Oct 10, 2010 12:56:06.847869000
    [Time delta from previous captured frame: 0.000562000 seconds]
    [Time delta from previous displayed frame: 0.000562000 seconds]
    [Time since reference or first frame: 102.418264000 seconds]
    Frame Number: 156
    Frame Length: 17 bytes
    Capture Length: 17 bytes
    [Frame is marked: False]
    [Protocols in frame: usb]
USB URB
    URB id: 0xffff88002c33bd80
    URB type: URB_COMPLETE ('C')
    URB transfer type: URB_CONTROL (2)
    Endpoint: 0x80
    Device: 5
    URB bus id: 1
    Device setup request: not present ('-')
    Data: present (0)
    URB status: Success (0)
    URB length [bytes]: 9
    Data length [bytes]: 9
    [Request in: 155]
    [Time from request: 0.000562000 seconds]
    [bInterfaceClass: HID (0x03)]
    CONFIGURATION DESCRIPTOR
        bLength: 0
        bDescriptorType: Unknown (0)
        wTotalLength: 0
        bNumInterfaces: 0
        bConfigurationValue: 0
        iConfiguration: 0
        Configuration bmAttributes: 0x00  NOT SELF-POWERED  NO REMOTE-WAKEUP
            0... .... = Must be 1: FIXME: Is this a USB 1.0 device
            .0.. .... = Self-Powered: This device is powered from the USB bus
            ..0. .... = Remote Wakeup: This device does NOT support remote wakeup
        bMaxPower: 0  (0mA)

No.     Time        Source                Destination           Protocol Info
    157 102.418282  host                  5.0                   USB      GET DESCRIPTOR Request CONFIGURATION[Packet size limited during capture]

Frame 157 (42 bytes on wire, 8 bytes captured)
    Arrival Time: Oct 10, 2010 12:56:06.847887000
    [Time delta from previous captured frame: 0.000018000 seconds]
    [Time delta from previous displayed frame: 0.000018000 seconds]
    [Time since reference or first frame: 102.418282000 seconds]
    Frame Number: 157
    Frame Length: 42 bytes
    Capture Length: 8 bytes
    [Frame is marked: False]
    [Protocols in frame: usb]
USB URB
    URB id: 0xffff88002c33bd80
    URB type: URB_SUBMIT ('S')
    URB transfer type: URB_CONTROL (2)
    Endpoint: 0x80
    Device: 5
    URB bus id: 1
    Device setup request: present (0)
    Data: not present ('<')
    URB status: Operation now in progress (-EINPROGRESS) (-115)
    URB length [bytes]: 34
    Data length [bytes]: 0
    [Response in: 158]
    [bInterfaceClass: HID (0x03)]
    URB setup
        bmRequestType: 0x80
            1... .... = Direction: Device-to-host
            .00. .... = Type: Standard (0x00)
            ...0 0000 = Recipient: Device (0x00)
        bRequest: GET DESCRIPTOR (6)
        Descriptor Index: 0x00
        bDescriptorType: CONFIGURATION (2)
        Language Id: no language specified (0x0000)
        wLength: 34
[Packet size limited during capture: USB truncated]

No.     Time        Source                Destination           Protocol Info
    158 102.419639  5.0                   host                  USB      GET DESCRIPTOR Response CONFIGURATION

Frame 158 (42 bytes on wire, 42 bytes captured)
    Arrival Time: Oct 10, 2010 12:56:06.849244000
    [Time delta from previous captured frame: 0.001357000 seconds]
    [Time delta from previous displayed frame: 0.001357000 seconds]
    [Time since reference or first frame: 102.419639000 seconds]
    Frame Number: 158
    Frame Length: 42 bytes
    Capture Length: 42 bytes
    [Frame is marked: False]
    [Protocols in frame: usb]
USB URB
    URB id: 0xffff88002c33bd80
    URB type: URB_COMPLETE ('C')
    URB transfer type: URB_CONTROL (2)
    Endpoint: 0x80
    Device: 5
    URB bus id: 1
    Device setup request: not present ('-')
    Data: present (0)
    URB status: Success (0)
    URB length [bytes]: 34
    Data length [bytes]: 34
    [Request in: 157]
    [Time from request: 0.001357000 seconds]
    [bInterfaceClass: HID (0x03)]
    CONFIGURATION DESCRIPTOR
        bLength: 0
        bDescriptorType: Unknown (0)
        wTotalLength: 0
        bNumInterfaces: 0
        bConfigurationValue: 0
        iConfiguration: 0
        Configuration bmAttributes: 0x00  NOT SELF-POWERED  NO REMOTE-WAKEUP
            0... .... = Must be 1: FIXME: Is this a USB 1.0 device
            .0.. .... = Self-Powered: This device is powered from the USB bus
            ..0. .... = Remote Wakeup: This device does NOT support remote wakeup
        bMaxPower: 0  (0mA)
    UNKNOWN DESCRIPTOR
        bLength: 2
    Invalid bLength: 2
        [Expert Info (Error/Malformed): Invalid bLength: 2]
            [Message: Invalid bLength: 2]
            [Severity level: Error]
            [Group: Malformed]
    UNKNOWN DESCRIPTOR
        bLength: 0
    Invalid bLength: 0
        [Expert Info (Error/Malformed): Invalid bLength: 0]
            [Message: Invalid bLength: 0]
            [Severity level: Error]
            [Group: Malformed]
    UNKNOWN DESCRIPTOR
        bLength: 0
    Invalid bLength: 0
        [Expert Info (Error/Malformed): Invalid bLength: 0]
            [Message: Invalid bLength: 0]
            [Severity level: Error]
            [Group: Malformed]
    UNKNOWN DESCRIPTOR
        bLength: 0
    Invalid bLength: 0
        [Expert Info (Error/Malformed): Invalid bLength: 0]
            [Message: Invalid bLength: 0]
            [Severity level: Error]
            [Group: Malformed]
    UNKNOWN DESCRIPTOR
        bLength: 0
    Invalid bLength: 0
        [Expert Info (Error/Malformed): Invalid bLength: 0]
            [Message: Invalid bLength: 0]
            [Severity level: Error]
            [Group: Malformed]
    UNKNOWN DESCRIPTOR
        bLength: 0
    Invalid bLength: 0
        [Expert Info (Error/Malformed): Invalid bLength: 0]
            [Message: Invalid bLength: 0]
            [Severity level: Error]
            [Group: Malformed]
    UNKNOWN DESCRIPTOR
        bLength: 0
    Invalid bLength: 0
        [Expert Info (Error/Malformed): Invalid bLength: 0]
            [Message: Invalid bLength: 0]
            [Severity level: Error]
            [Group: Malformed]
    UNKNOWN DESCRIPTOR
        bLength: 9
        bDescriptorType: CONFIGURATION (2)
    INTERFACE DESCRIPTOR
        bLength: 9
        bDescriptorType: INTERFACE (4)
        bInterfaceNumber: 0
        bAlternateSetting: 0
        bNumEndpoints: 1
        bInterfaceClass: HID (0x03)
        bInterfaceSubClass: 0x00
        bInterfaceProtocol: 0x00
        iInterface: 0

No.     Time        Source                Destination           Protocol Info
    159 102.419684  5.1                   host                  USB      URB_INTERRUPT

Frame 159 (8 bytes on wire, 8 bytes captured)
    Arrival Time: Oct 10, 2010 12:56:06.849289000
    [Time delta from previous captured frame: 0.000045000 seconds]
    [Time delta from previous displayed frame: 0.000045000 seconds]
    [Time since reference or first frame: 102.419684000 seconds]
    Frame Number: 159
    Frame Length: 8 bytes
    Capture Length: 8 bytes
    [Frame is marked: False]
    [Protocols in frame: usb]
USB URB
    URB id: 0xffff880128db93c0
    URB type: URB_COMPLETE ('C')
    URB transfer type: URB_INTERRUPT (1)
    Endpoint: 0x81
    Device: 5
    URB bus id: 1
    Device setup request: not present ('-')
    Data: present (0)
    URB status: Cannot send after transport endpoint shutdown (-ESHUTDOWN) (-108)
    URB length [bytes]: 0
    Data length [bytes]: 0

No.     Time        Source                Destination           Protocol Info
    162 102.698232  host                  5.0                   USB      GET DESCRIPTOR Request DEVICE[Packet size limited during capture]

Frame 162 (72 bytes on wire, 8 bytes captured)
    Arrival Time: Oct 10, 2010 12:56:07.127837000
    [Time delta from previous captured frame: 0.247542000 seconds]
    [Time delta from previous displayed frame: 0.278548000 seconds]
    [Time since reference or first frame: 102.698232000 seconds]
    Frame Number: 162
    Frame Length: 72 bytes
    Capture Length: 8 bytes
    [Frame is marked: False]
    [Protocols in frame: usb]
USB URB
    URB id: 0xffff88002c2ead80
    URB type: URB_SUBMIT ('S')
    URB transfer type: URB_CONTROL (2)
    Endpoint: 0x80
    Device: 5
    URB bus id: 1
    Device setup request: present (0)
    Data: not present ('<')
    URB status: Operation now in progress (-EINPROGRESS) (-115)
    URB length [bytes]: 64
    Data length [bytes]: 0
    [Response in: 163]
    [bInterfaceClass: HID (0x03)]
    URB setup
        bmRequestType: 0x80
            1... .... = Direction: Device-to-host
            .00. .... = Type: Standard (0x00)
            ...0 0000 = Recipient: Device (0x00)
        bRequest: GET DESCRIPTOR (6)
        Descriptor Index: 0x00
        bDescriptorType: DEVICE (1)
        Language Id: no language specified (0x0000)
        wLength: 64
[Packet size limited during capture: USB truncated]

No.     Time        Source                Destination           Protocol Info
    163 102.699091  5.0                   host                  USB      GET DESCRIPTOR Response DEVICE

Frame 163 (26 bytes on wire, 26 bytes captured)
    Arrival Time: Oct 10, 2010 12:56:07.128696000
    [Time delta from previous captured frame: 0.000859000 seconds]
    [Time delta from previous displayed frame: 0.000859000 seconds]
    [Time since reference or first frame: 102.699091000 seconds]
    Frame Number: 163
    Frame Length: 26 bytes
    Capture Length: 26 bytes
    [Frame is marked: False]
    [Protocols in frame: usb]
USB URB
    URB id: 0xffff88002c2ead80
    URB type: URB_COMPLETE ('C')
    URB transfer type: URB_CONTROL (2)
    Endpoint: 0x80
    Device: 5
    URB bus id: 1
    Device setup request: not present ('-')
    Data: present (0)
    URB status: Success (0)
    URB length [bytes]: 18
    Data length [bytes]: 18
    [Request in: 162]
    [Time from request: 0.000859000 seconds]
    [bInterfaceClass: HID (0x03)]
    DEVICE DESCRIPTOR
        bLength: 0
        bDescriptorType: Unknown (0)
        bcdUSB: 0x0000
        bDeviceClass: 0
        bDeviceSubClass: 0
        bDeviceProtocol: 0
        bMaxPacketSize0: 0
        idVendor: 0x0200
        idProduct: 0x0000
        bcdDevice: 0x0000
        iManufacturer: 0
        iProduct: 0
        iSerialNumber: 18
        bNumConfigurations: 1

No.     Time        Source                Destination           Protocol Info
    164 102.780824  host                  5.0                   USB      GET DESCRIPTOR Request DEVICE[Packet size limited during capture]

Frame 164 (26 bytes on wire, 8 bytes captured)
    Arrival Time: Oct 10, 2010 12:56:07.210429000
    [Time delta from previous captured frame: 0.081733000 seconds]
    [Time delta from previous displayed frame: 0.081733000 seconds]
    [Time since reference or first frame: 102.780824000 seconds]
    Frame Number: 164
    Frame Length: 26 bytes
    Capture Length: 8 bytes
    [Frame is marked: False]
    [Protocols in frame: usb]
USB URB
    URB id: 0xffff88002c2ead80
    URB type: URB_SUBMIT ('S')
    URB transfer type: URB_CONTROL (2)
    Endpoint: 0x80
    Device: 5
    URB bus id: 1
    Device setup request: present (0)
    Data: not present ('<')
    URB status: Operation now in progress (-EINPROGRESS) (-115)
    URB length [bytes]: 18
    Data length [bytes]: 0
    [Response in: 165]
    [bInterfaceClass: HID (0x03)]
    URB setup
        bmRequestType: 0x80
            1... .... = Direction: Device-to-host
            .00. .... = Type: Standard (0x00)
            ...0 0000 = Recipient: Device (0x00)
        bRequest: GET DESCRIPTOR (6)
        Descriptor Index: 0x00
        bDescriptorType: DEVICE (1)
        Language Id: no language specified (0x0000)
        wLength: 18
[Packet size limited during capture: USB truncated]

No.     Time        Source                Destination           Protocol Info
    165 102.781707  5.0                   host                  USB      GET DESCRIPTOR Response DEVICE

Frame 165 (26 bytes on wire, 26 bytes captured)
    Arrival Time: Oct 10, 2010 12:56:07.211312000
    [Time delta from previous captured frame: 0.000883000 seconds]
    [Time delta from previous displayed frame: 0.000883000 seconds]
    [Time since reference or first frame: 102.781707000 seconds]
    Frame Number: 165
    Frame Length: 26 bytes
    Capture Length: 26 bytes
    [Frame is marked: False]
    [Protocols in frame: usb]
USB URB
    URB id: 0xffff88002c2ead80
    URB type: URB_COMPLETE ('C')
    URB transfer type: URB_CONTROL (2)
    Endpoint: 0x80
    Device: 5
    URB bus id: 1
    Device setup request: not present ('-')
    Data: present (0)
    URB status: Success (0)
    URB length [bytes]: 18
    Data length [bytes]: 18
    [Request in: 164]
    [Time from request: 0.000883000 seconds]
    [bInterfaceClass: HID (0x03)]
    DEVICE DESCRIPTOR
        bLength: 0
        bDescriptorType: Unknown (0)
        bcdUSB: 0x0000
        bDeviceClass: 0
        bDeviceSubClass: 0
        bDeviceProtocol: 0
        bMaxPacketSize0: 0
        idVendor: 0x0200
        idProduct: 0x0000
        bcdDevice: 0x0000
        iManufacturer: 0
        iProduct: 0
        iSerialNumber: 18
        bNumConfigurations: 1

No.     Time        Source                Destination           Protocol Info
    166 102.790821  host                  5.0                   USB      GET DESCRIPTOR Request CONFIGURATION[Packet size limited during capture]

Frame 166 (17 bytes on wire, 8 bytes captured)
    Arrival Time: Oct 10, 2010 12:56:07.220426000
    [Time delta from previous captured frame: 0.009114000 seconds]
    [Time delta from previous displayed frame: 0.009114000 seconds]
    [Time since reference or first frame: 102.790821000 seconds]
    Frame Number: 166
    Frame Length: 17 bytes
    Capture Length: 8 bytes
    [Frame is marked: False]
    [Protocols in frame: usb]
USB URB
    URB id: 0xffff88002c2ead80
    URB type: URB_SUBMIT ('S')
    URB transfer type: URB_CONTROL (2)
    Endpoint: 0x80
    Device: 5
    URB bus id: 1
    Device setup request: present (0)
    Data: not present ('<')
    URB status: Operation now in progress (-EINPROGRESS) (-115)
    URB length [bytes]: 9
    Data length [bytes]: 0
    [Response in: 167]
    [bInterfaceClass: HID (0x03)]
    URB setup
        bmRequestType: 0x80
            1... .... = Direction: Device-to-host
            .00. .... = Type: Standard (0x00)
            ...0 0000 = Recipient: Device (0x00)
        bRequest: GET DESCRIPTOR (6)
        Descriptor Index: 0x00
        bDescriptorType: CONFIGURATION (2)
        Language Id: no language specified (0x0000)
        wLength: 9
[Packet size limited during capture: USB truncated]

No.     Time        Source                Destination           Protocol Info
    167 102.791583  5.0                   host                  USB      GET DESCRIPTOR Response CONFIGURATION

Frame 167 (17 bytes on wire, 17 bytes captured)
    Arrival Time: Oct 10, 2010 12:56:07.221188000
    [Time delta from previous captured frame: 0.000762000 seconds]
    [Time delta from previous displayed frame: 0.000762000 seconds]
    [Time since reference or first frame: 102.791583000 seconds]
    Frame Number: 167
    Frame Length: 17 bytes
    Capture Length: 17 bytes
    [Frame is marked: False]
    [Protocols in frame: usb]
USB URB
    URB id: 0xffff88002c2ead80
    URB type: URB_COMPLETE ('C')
    URB transfer type: URB_CONTROL (2)
    Endpoint: 0x80
    Device: 5
    URB bus id: 1
    Device setup request: not present ('-')
    Data: present (0)
    URB status: Success (0)
    URB length [bytes]: 9
    Data length [bytes]: 9
    [Request in: 166]
    [Time from request: 0.000762000 seconds]
    [bInterfaceClass: HID (0x03)]
    CONFIGURATION DESCRIPTOR
        bLength: 0
        bDescriptorType: Unknown (0)
        wTotalLength: 0
        bNumInterfaces: 0
        bConfigurationValue: 0
        iConfiguration: 0
        Configuration bmAttributes: 0x00  NOT SELF-POWERED  NO REMOTE-WAKEUP
            0... .... = Must be 1: FIXME: Is this a USB 1.0 device
            .0.. .... = Self-Powered: This device is powered from the USB bus
            ..0. .... = Remote Wakeup: This device does NOT support remote wakeup
        bMaxPower: 0  (0mA)

No.     Time        Source                Destination           Protocol Info
    168 102.800821  host                  5.0                   USB      GET DESCRIPTOR Request CONFIGURATION[Packet size limited during capture]

Frame 168 (263 bytes on wire, 8 bytes captured)
    Arrival Time: Oct 10, 2010 12:56:07.230426000
    [Time delta from previous captured frame: 0.009238000 seconds]
    [Time delta from previous displayed frame: 0.009238000 seconds]
    [Time since reference or first frame: 102.800821000 seconds]
    Frame Number: 168
    Frame Length: 263 bytes
    Capture Length: 8 bytes
    [Frame is marked: False]
    [Protocols in frame: usb]
USB URB
    URB id: 0xffff88002c2ead80
    URB type: URB_SUBMIT ('S')
    URB transfer type: URB_CONTROL (2)
    Endpoint: 0x80
    Device: 5
    URB bus id: 1
    Device setup request: present (0)
    Data: not present ('<')
    URB status: Operation now in progress (-EINPROGRESS) (-115)
    URB length [bytes]: 255
    Data length [bytes]: 0
    [Response in: 169]
    [bInterfaceClass: HID (0x03)]
    URB setup
        bmRequestType: 0x80
            1... .... = Direction: Device-to-host
            .00. .... = Type: Standard (0x00)
            ...0 0000 = Recipient: Device (0x00)
        bRequest: GET DESCRIPTOR (6)
        Descriptor Index: 0x00
        bDescriptorType: CONFIGURATION (2)
        Language Id: no language specified (0x0000)
        wLength: 255
[Packet size limited during capture: USB truncated]

No.     Time        Source                Destination           Protocol Info
    169 102.802083  5.0                   host                  USB      GET DESCRIPTOR Response CONFIGURATION

Frame 169 (42 bytes on wire, 42 bytes captured)
    Arrival Time: Oct 10, 2010 12:56:07.231688000
    [Time delta from previous captured frame: 0.001262000 seconds]
    [Time delta from previous displayed frame: 0.001262000 seconds]
    [Time since reference or first frame: 102.802083000 seconds]
    Frame Number: 169
    Frame Length: 42 bytes
    Capture Length: 42 bytes
    [Frame is marked: False]
    [Protocols in frame: usb]
USB URB
    URB id: 0xffff88002c2ead80
    URB type: URB_COMPLETE ('C')
    URB transfer type: URB_CONTROL (2)
    Endpoint: 0x80
    Device: 5
    URB bus id: 1
    Device setup request: not present ('-')
    Data: present (0)
    URB status: Success (0)
    URB length [bytes]: 34
    Data length [bytes]: 34
    [Request in: 168]
    [Time from request: 0.001262000 seconds]
    [bInterfaceClass: HID (0x03)]
    CONFIGURATION DESCRIPTOR
        bLength: 0
        bDescriptorType: Unknown (0)
        wTotalLength: 0
        bNumInterfaces: 0
        bConfigurationValue: 0
        iConfiguration: 0
        Configuration bmAttributes: 0x00  NOT SELF-POWERED  NO REMOTE-WAKEUP
            0... .... = Must be 1: FIXME: Is this a USB 1.0 device
            .0.. .... = Self-Powered: This device is powered from the USB bus
            ..0. .... = Remote Wakeup: This device does NOT support remote wakeup
        bMaxPower: 0  (0mA)
    UNKNOWN DESCRIPTOR
        bLength: 2
    Invalid bLength: 2
        [Expert Info (Error/Malformed): Invalid bLength: 2]
            [Message: Invalid bLength: 2]
            [Severity level: Error]
            [Group: Malformed]
    UNKNOWN DESCRIPTOR
        bLength: 0
    Invalid bLength: 0
        [Expert Info (Error/Malformed): Invalid bLength: 0]
            [Message: Invalid bLength: 0]
            [Severity level: Error]
            [Group: Malformed]
    UNKNOWN DESCRIPTOR
        bLength: 0
    Invalid bLength: 0
        [Expert Info (Error/Malformed): Invalid bLength: 0]
            [Message: Invalid bLength: 0]
            [Severity level: Error]
            [Group: Malformed]
    UNKNOWN DESCRIPTOR
        bLength: 0
    Invalid bLength: 0
        [Expert Info (Error/Malformed): Invalid bLength: 0]
            [Message: Invalid bLength: 0]
            [Severity level: Error]
            [Group: Malformed]
    UNKNOWN DESCRIPTOR
        bLength: 0
    Invalid bLength: 0
        [Expert Info (Error/Malformed): Invalid bLength: 0]
            [Message: Invalid bLength: 0]
            [Severity level: Error]
            [Group: Malformed]
    UNKNOWN DESCRIPTOR
        bLength: 0
    Invalid bLength: 0
        [Expert Info (Error/Malformed): Invalid bLength: 0]
            [Message: Invalid bLength: 0]
            [Severity level: Error]
            [Group: Malformed]
    UNKNOWN DESCRIPTOR
        bLength: 0
    Invalid bLength: 0
        [Expert Info (Error/Malformed): Invalid bLength: 0]
            [Message: Invalid bLength: 0]
            [Severity level: Error]
            [Group: Malformed]
    UNKNOWN DESCRIPTOR
        bLength: 9
        bDescriptorType: CONFIGURATION (2)
    INTERFACE DESCRIPTOR
        bLength: 9
        bDescriptorType: INTERFACE (4)
        bInterfaceNumber: 0
        bAlternateSetting: 0
        bNumEndpoints: 1
        bInterfaceClass: HID (0x03)
        bInterfaceSubClass: 0x00
        bInterfaceProtocol: 0x00
        iInterface: 0

No.     Time        Source                Destination           Protocol Info
    170 102.809792  host                  5.0                   USB      GET DESCRIPTOR Request STRING[Packet size limited during capture]

Frame 170 (263 bytes on wire, 8 bytes captured)
    Arrival Time: Oct 10, 2010 12:56:07.239397000
    [Time delta from previous captured frame: 0.007709000 seconds]
    [Time delta from previous displayed frame: 0.007709000 seconds]
    [Time since reference or first frame: 102.809792000 seconds]
    Frame Number: 170
    Frame Length: 263 bytes
    Capture Length: 8 bytes
    [Frame is marked: False]
    [Protocols in frame: usb]
USB URB
    URB id: 0xffff88002c2ead80
    URB type: URB_SUBMIT ('S')
    URB transfer type: URB_CONTROL (2)
    Endpoint: 0x80
    Device: 5
    URB bus id: 1
    Device setup request: present (0)
    Data: not present ('<')
    URB status: Operation now in progress (-EINPROGRESS) (-115)
    URB length [bytes]: 255
    Data length [bytes]: 0
    [Response in: 171]
    [bInterfaceClass: HID (0x03)]
    URB setup
        bmRequestType: 0x80
            1... .... = Direction: Device-to-host
            .00. .... = Type: Standard (0x00)
            ...0 0000 = Recipient: Device (0x00)
        bRequest: GET DESCRIPTOR (6)
        Descriptor Index: 0x00
        bDescriptorType: STRING (3)
        Language Id: no language specified (0x0000)
        wLength: 255
[Packet size limited during capture: USB truncated]

No.     Time        Source                Destination           Protocol Info
    171 102.810211  5.0                   host                  USB      GET DESCRIPTOR Response STRING

Frame 171 (12 bytes on wire, 12 bytes captured)
    Arrival Time: Oct 10, 2010 12:56:07.239816000
    [Time delta from previous captured frame: 0.000419000 seconds]
    [Time delta from previous displayed frame: 0.000419000 seconds]
    [Time since reference or first frame: 102.810211000 seconds]
    Frame Number: 171
    Frame Length: 12 bytes
    Capture Length: 12 bytes
    [Frame is marked: False]
    [Protocols in frame: usb]
USB URB
    URB id: 0xffff88002c2ead80
    URB type: URB_COMPLETE ('C')
    URB transfer type: URB_CONTROL (2)
    Endpoint: 0x80
    Device: 5
    URB bus id: 1
    Device setup request: not present ('-')
    Data: present (0)
    URB status: Success (0)
    URB length [bytes]: 4
    Data length [bytes]: 4
    [Request in: 170]
    [Time from request: 0.000419000 seconds]
    [bInterfaceClass: HID (0x03)]
    STRING DESCRIPTOR
        bLength: 0
        bDescriptorType: Unknown (0)
    Application Data: 0000

No.     Time        Source                Destination           Protocol Info
    172 102.818224  host                  5.0                   USB      GET DESCRIPTOR Request STRING[Packet size limited during capture]

Frame 172 (263 bytes on wire, 8 bytes captured)
    Arrival Time: Oct 10, 2010 12:56:07.247829000
    [Time delta from previous captured frame: 0.008013000 seconds]
    [Time delta from previous displayed frame: 0.008013000 seconds]
    [Time since reference or first frame: 102.818224000 seconds]
    Frame Number: 172
    Frame Length: 263 bytes
    Capture Length: 8 bytes
    [Frame is marked: False]
    [Protocols in frame: usb]
USB URB
    URB id: 0xffff88002c2ead80
    URB type: URB_SUBMIT ('S')
    URB transfer type: URB_CONTROL (2)
    Endpoint: 0x80
    Device: 5
    URB bus id: 1
    Device setup request: present (0)
    Data: not present ('<')
    URB status: Operation now in progress (-EINPROGRESS) (-115)
    URB length [bytes]: 255
    Data length [bytes]: 0
    [Response in: 173]
    [bInterfaceClass: HID (0x03)]
    URB setup
        bmRequestType: 0x80
            1... .... = Direction: Device-to-host
            .00. .... = Type: Standard (0x00)
            ...0 0000 = Recipient: Device (0x00)
        bRequest: GET DESCRIPTOR (6)
        Descriptor Index: 0x02
        bDescriptorType: STRING (3)
        Language Id: English (United States) (0x0409)
        wLength: 255
[Packet size limited during capture: USB truncated]

No.     Time        Source                Destination           Protocol Info
    173 102.820586  5.0                   host                  USB      GET DESCRIPTOR Response STRING[Malformed Packet]

Frame 173 (86 bytes on wire, 86 bytes captured)
    Arrival Time: Oct 10, 2010 12:56:07.250191000
    [Time delta from previous captured frame: 0.002362000 seconds]
    [Time delta from previous displayed frame: 0.002362000 seconds]
    [Time since reference or first frame: 102.820586000 seconds]
    Frame Number: 173
    Frame Length: 86 bytes
    Capture Length: 86 bytes
    [Frame is marked: False]
    [Protocols in frame: usb]
USB URB
    URB id: 0xffff88002c2ead80
    URB type: URB_COMPLETE ('C')
    URB transfer type: URB_CONTROL (2)
    Endpoint: 0x80
    Device: 5
    URB bus id: 1
    Device setup request: not present ('-')
    Data: present (0)
    URB status: Success (0)
    URB length [bytes]: 78
    Data length [bytes]: 78
    [Request in: 172]
    [Time from request: 0.002362000 seconds]
    [bInterfaceClass: HID (0x03)]
    STRING DESCRIPTOR
        bLength: 0
        bDescriptorType: Unknown (0)
[Malformed Packet: USB]
    [Expert Info (Error/Malformed): Malformed Packet (Exception occurred)]
        [Message: Malformed Packet (Exception occurred)]
        [Severity level: Error]
        [Group: Malformed]

No.     Time        Source                Destination           Protocol Info
    174 102.828223  host                  5.0                   USB      GET DESCRIPTOR Request STRING[Packet size limited during capture]

Frame 174 (263 bytes on wire, 8 bytes captured)
    Arrival Time: Oct 10, 2010 12:56:07.257828000
    [Time delta from previous captured frame: 0.007637000 seconds]
    [Time delta from previous displayed frame: 0.007637000 seconds]
    [Time since reference or first frame: 102.828223000 seconds]
    Frame Number: 174
    Frame Length: 263 bytes
    Capture Length: 8 bytes
    [Frame is marked: False]
    [Protocols in frame: usb]
USB URB
    URB id: 0xffff88002c2ead80
    URB type: URB_SUBMIT ('S')
    URB transfer type: URB_CONTROL (2)
    Endpoint: 0x80
    Device: 5
    URB bus id: 1
    Device setup request: present (0)
    Data: not present ('<')
    URB status: Operation now in progress (-EINPROGRESS) (-115)
    URB length [bytes]: 255
    Data length [bytes]: 0
    [Response in: 175]
    [bInterfaceClass: HID (0x03)]
    URB setup
        bmRequestType: 0x80
            1... .... = Direction: Device-to-host
            .00. .... = Type: Standard (0x00)
            ...0 0000 = Recipient: Device (0x00)
        bRequest: GET DESCRIPTOR (6)
        Descriptor Index: 0x00
        bDescriptorType: STRING (3)
        Language Id: no language specified (0x0000)
        wLength: 255
[Packet size limited during capture: USB truncated]

No.     Time        Source                Destination           Protocol Info
    175 102.828838  5.0                   host                  USB      GET DESCRIPTOR Response STRING

Frame 175 (12 bytes on wire, 12 bytes captured)
    Arrival Time: Oct 10, 2010 12:56:07.258443000
    [Time delta from previous captured frame: 0.000615000 seconds]
    [Time delta from previous displayed frame: 0.000615000 seconds]
    [Time since reference or first frame: 102.828838000 seconds]
    Frame Number: 175
    Frame Length: 12 bytes
    Capture Length: 12 bytes
    [Frame is marked: False]
    [Protocols in frame: usb]
USB URB
    URB id: 0xffff88002c2ead80
    URB type: URB_COMPLETE ('C')
    URB transfer type: URB_CONTROL (2)
    Endpoint: 0x80
    Device: 5
    URB bus id: 1
    Device setup request: not present ('-')
    Data: present (0)
    URB status: Success (0)
    URB length [bytes]: 4
    Data length [bytes]: 4
    [Request in: 174]
    [Time from request: 0.000615000 seconds]
    [bInterfaceClass: HID (0x03)]
    STRING DESCRIPTOR
        bLength: 0
        bDescriptorType: Unknown (0)
    Application Data: 0000

No.     Time        Source                Destination           Protocol Info
    176 102.838223  host                  5.0                   USB      GET DESCRIPTOR Request STRING[Packet size limited during capture]

Frame 176 (263 bytes on wire, 8 bytes captured)
    Arrival Time: Oct 10, 2010 12:56:07.267828000
    [Time delta from previous captured frame: 0.009385000 seconds]
    [Time delta from previous displayed frame: 0.009385000 seconds]
    [Time since reference or first frame: 102.838223000 seconds]
    Frame Number: 176
    Frame Length: 263 bytes
    Capture Length: 8 bytes
    [Frame is marked: False]
    [Protocols in frame: usb]
USB URB
    URB id: 0xffff88002c2ead80
    URB type: URB_SUBMIT ('S')
    URB transfer type: URB_CONTROL (2)
    Endpoint: 0x80
    Device: 5
    URB bus id: 1
    Device setup request: present (0)
    Data: not present ('<')
    URB status: Operation now in progress (-EINPROGRESS) (-115)
    URB length [bytes]: 255
    Data length [bytes]: 0
    [Response in: 177]
    [bInterfaceClass: HID (0x03)]
    URB setup
        bmRequestType: 0x80
            1... .... = Direction: Device-to-host
            .00. .... = Type: Standard (0x00)
            ...0 0000 = Recipient: Device (0x00)
        bRequest: GET DESCRIPTOR (6)
        Descriptor Index: 0x02
        bDescriptorType: STRING (3)
        Language Id: English (United States) (0x0409)
        wLength: 255
[Packet size limited during capture: USB truncated]

No.     Time        Source                Destination           Protocol Info
    177 102.840590  5.0                   host                  USB      GET DESCRIPTOR Response STRING[Malformed Packet]

Frame 177 (86 bytes on wire, 86 bytes captured)
    Arrival Time: Oct 10, 2010 12:56:07.270195000
    [Time delta from previous captured frame: 0.002367000 seconds]
    [Time delta from previous displayed frame: 0.002367000 seconds]
    [Time since reference or first frame: 102.840590000 seconds]
    Frame Number: 177
    Frame Length: 86 bytes
    Capture Length: 86 bytes
    [Frame is marked: False]
    [Protocols in frame: usb]
USB URB
    URB id: 0xffff88002c2ead80
    URB type: URB_COMPLETE ('C')
    URB transfer type: URB_CONTROL (2)
    Endpoint: 0x80
    Device: 5
    URB bus id: 1
    Device setup request: not present ('-')
    Data: present (0)
    URB status: Success (0)
    URB length [bytes]: 78
    Data length [bytes]: 78
    [Request in: 176]
    [Time from request: 0.002367000 seconds]
    [bInterfaceClass: HID (0x03)]
    STRING DESCRIPTOR
        bLength: 0
        bDescriptorType: Unknown (0)
[Malformed Packet: USB]
    [Expert Info (Error/Malformed): Malformed Packet (Exception occurred)]
        [Message: Malformed Packet (Exception occurred)]
        [Severity level: Error]
        [Group: Malformed]

No.     Time        Source                Destination           Protocol Info
    178 102.908230  host                  5.0                   USB      GET DESCRIPTOR Request DEVICE[Packet size limited during capture]

Frame 178 (26 bytes on wire, 8 bytes captured)
    Arrival Time: Oct 10, 2010 12:56:07.337835000
    [Time delta from previous captured frame: 0.067640000 seconds]
    [Time delta from previous displayed frame: 0.067640000 seconds]
    [Time since reference or first frame: 102.908230000 seconds]
    Frame Number: 178
    Frame Length: 26 bytes
    Capture Length: 8 bytes
    [Frame is marked: False]
    [Protocols in frame: usb]
USB URB
    URB id: 0xffff88002c2fee40
    URB type: URB_SUBMIT ('S')
    URB transfer type: URB_CONTROL (2)
    Endpoint: 0x80
    Device: 5
    URB bus id: 1
    Device setup request: present (0)
    Data: not present ('<')
    URB status: Operation now in progress (-EINPROGRESS) (-115)
    URB length [bytes]: 18
    Data length [bytes]: 0
    [Response in: 179]
    [bInterfaceClass: HID (0x03)]
    URB setup
        bmRequestType: 0x80
            1... .... = Direction: Device-to-host
            .00. .... = Type: Standard (0x00)
            ...0 0000 = Recipient: Device (0x00)
        bRequest: GET DESCRIPTOR (6)
        Descriptor Index: 0x00
        bDescriptorType: DEVICE (1)
        Language Id: no language specified (0x0000)
        wLength: 18
[Packet size limited during capture: USB truncated]

No.     Time        Source                Destination           Protocol Info
    179 102.909105  5.0                   host                  USB      GET DESCRIPTOR Response DEVICE

Frame 179 (26 bytes on wire, 26 bytes captured)
    Arrival Time: Oct 10, 2010 12:56:07.338710000
    [Time delta from previous captured frame: 0.000875000 seconds]
    [Time delta from previous displayed frame: 0.000875000 seconds]
    [Time since reference or first frame: 102.909105000 seconds]
    Frame Number: 179
    Frame Length: 26 bytes
    Capture Length: 26 bytes
    [Frame is marked: False]
    [Protocols in frame: usb]
USB URB
    URB id: 0xffff88002c2fee40
    URB type: URB_COMPLETE ('C')
    URB transfer type: URB_CONTROL (2)
    Endpoint: 0x80
    Device: 5
    URB bus id: 1
    Device setup request: not present ('-')
    Data: present (0)
    URB status: Success (0)
    URB length [bytes]: 18
    Data length [bytes]: 18
    [Request in: 178]
    [Time from request: 0.000875000 seconds]
    [bInterfaceClass: HID (0x03)]
    DEVICE DESCRIPTOR
        bLength: 0
        bDescriptorType: Unknown (0)
        bcdUSB: 0x0000
        bDeviceClass: 0
        bDeviceSubClass: 0
        bDeviceProtocol: 0
        bMaxPacketSize0: 0
        idVendor: 0x0200
        idProduct: 0x0000
        bcdDevice: 0x0000
        iManufacturer: 0
        iProduct: 0
        iSerialNumber: 18
        bNumConfigurations: 1

No.     Time        Source                Destination           Protocol Info
    180 102.912656  host                  5.0                   USB      GET DESCRIPTOR Request CONFIGURATION[Packet size limited during capture]

Frame 180 (17 bytes on wire, 8 bytes captured)
    Arrival Time: Oct 10, 2010 12:56:07.342261000
    [Time delta from previous captured frame: 0.003551000 seconds]
    [Time delta from previous displayed frame: 0.003551000 seconds]
    [Time since reference or first frame: 102.912656000 seconds]
    Frame Number: 180
    Frame Length: 17 bytes
    Capture Length: 8 bytes
    [Frame is marked: False]
    [Protocols in frame: usb]
USB URB
    URB id: 0xffff88002c2fee40
    URB type: URB_SUBMIT ('S')
    URB transfer type: URB_CONTROL (2)
    Endpoint: 0x80
    Device: 5
    URB bus id: 1
    Device setup request: present (0)
    Data: not present ('<')
    URB status: Operation now in progress (-EINPROGRESS) (-115)
    URB length [bytes]: 9
    Data length [bytes]: 0
    [Response in: 181]
    [bInterfaceClass: HID (0x03)]
    URB setup
        bmRequestType: 0x80
            1... .... = Direction: Device-to-host
            .00. .... = Type: Standard (0x00)
            ...0 0000 = Recipient: Device (0x00)
        bRequest: GET DESCRIPTOR (6)
        Descriptor Index: 0x00
        bDescriptorType: CONFIGURATION (2)
        Language Id: no language specified (0x0000)
        wLength: 9
[Packet size limited during capture: USB truncated]

No.     Time        Source                Destination           Protocol Info
    181 102.913355  5.0                   host                  USB      GET DESCRIPTOR Response CONFIGURATION

Frame 181 (17 bytes on wire, 17 bytes captured)
    Arrival Time: Oct 10, 2010 12:56:07.342960000
    [Time delta from previous captured frame: 0.000699000 seconds]
    [Time delta from previous displayed frame: 0.000699000 seconds]
    [Time since reference or first frame: 102.913355000 seconds]
    Frame Number: 181
    Frame Length: 17 bytes
    Capture Length: 17 bytes
    [Frame is marked: False]
    [Protocols in frame: usb]
USB URB
    URB id: 0xffff88002c2fee40
    URB type: URB_COMPLETE ('C')
    URB transfer type: URB_CONTROL (2)
    Endpoint: 0x80
    Device: 5
    URB bus id: 1
    Device setup request: not present ('-')
    Data: present (0)
    URB status: Success (0)
    URB length [bytes]: 9
    Data length [bytes]: 9
    [Request in: 180]
    [Time from request: 0.000699000 seconds]
    [bInterfaceClass: HID (0x03)]
    CONFIGURATION DESCRIPTOR
        bLength: 0
        bDescriptorType: Unknown (0)
        wTotalLength: 0
        bNumInterfaces: 0
        bConfigurationValue: 0
        iConfiguration: 0
        Configuration bmAttributes: 0x00  NOT SELF-POWERED  NO REMOTE-WAKEUP
            0... .... = Must be 1: FIXME: Is this a USB 1.0 device
            .0.. .... = Self-Powered: This device is powered from the USB bus
            ..0. .... = Remote Wakeup: This device does NOT support remote wakeup
        bMaxPower: 0  (0mA)

No.     Time        Source                Destination           Protocol Info
    182 102.928224  host                  5.0                   USB      GET DESCRIPTOR Request CONFIGURATION[Packet size limited during capture]

Frame 182 (42 bytes on wire, 8 bytes captured)
    Arrival Time: Oct 10, 2010 12:56:07.357829000
    [Time delta from previous captured frame: 0.014869000 seconds]
    [Time delta from previous displayed frame: 0.014869000 seconds]
    [Time since reference or first frame: 102.928224000 seconds]
    Frame Number: 182
    Frame Length: 42 bytes
    Capture Length: 8 bytes
    [Frame is marked: False]
    [Protocols in frame: usb]
USB URB
    URB id: 0xffff88002c2fee40
    URB type: URB_SUBMIT ('S')
    URB transfer type: URB_CONTROL (2)
    Endpoint: 0x80
    Device: 5
    URB bus id: 1
    Device setup request: present (0)
    Data: not present ('<')
    URB status: Operation now in progress (-EINPROGRESS) (-115)
    URB length [bytes]: 34
    Data length [bytes]: 0
    [Response in: 183]
    [bInterfaceClass: HID (0x03)]
    URB setup
        bmRequestType: 0x80
            1... .... = Direction: Device-to-host
            .00. .... = Type: Standard (0x00)
            ...0 0000 = Recipient: Device (0x00)
        bRequest: GET DESCRIPTOR (6)
        Descriptor Index: 0x00
        bDescriptorType: CONFIGURATION (2)
        Language Id: no language specified (0x0000)
        wLength: 34
[Packet size limited during capture: USB truncated]

No.     Time        Source                Destination           Protocol Info
    183 102.929608  5.0                   host                  USB      GET DESCRIPTOR Response CONFIGURATION

Frame 183 (42 bytes on wire, 42 bytes captured)
    Arrival Time: Oct 10, 2010 12:56:07.359213000
    [Time delta from previous captured frame: 0.001384000 seconds]
    [Time delta from previous displayed frame: 0.001384000 seconds]
    [Time since reference or first frame: 102.929608000 seconds]
    Frame Number: 183
    Frame Length: 42 bytes
    Capture Length: 42 bytes
    [Frame is marked: False]
    [Protocols in frame: usb]
USB URB
    URB id: 0xffff88002c2fee40
    URB type: URB_COMPLETE ('C')
    URB transfer type: URB_CONTROL (2)
    Endpoint: 0x80
    Device: 5
    URB bus id: 1
    Device setup request: not present ('-')
    Data: present (0)
    URB status: Success (0)
    URB length [bytes]: 34
    Data length [bytes]: 34
    [Request in: 182]
    [Time from request: 0.001384000 seconds]
    [bInterfaceClass: HID (0x03)]
    CONFIGURATION DESCRIPTOR
        bLength: 0
        bDescriptorType: Unknown (0)
        wTotalLength: 0
        bNumInterfaces: 0
        bConfigurationValue: 0
        iConfiguration: 0
        Configuration bmAttributes: 0x00  NOT SELF-POWERED  NO REMOTE-WAKEUP
            0... .... = Must be 1: FIXME: Is this a USB 1.0 device
            .0.. .... = Self-Powered: This device is powered from the USB bus
            ..0. .... = Remote Wakeup: This device does NOT support remote wakeup
        bMaxPower: 0  (0mA)
    UNKNOWN DESCRIPTOR
        bLength: 2
    Invalid bLength: 2
        [Expert Info (Error/Malformed): Invalid bLength: 2]
            [Message: Invalid bLength: 2]
            [Severity level: Error]
            [Group: Malformed]
    UNKNOWN DESCRIPTOR
        bLength: 0
    Invalid bLength: 0
        [Expert Info (Error/Malformed): Invalid bLength: 0]
            [Message: Invalid bLength: 0]
            [Severity level: Error]
            [Group: Malformed]
    UNKNOWN DESCRIPTOR
        bLength: 0
    Invalid bLength: 0
        [Expert Info (Error/Malformed): Invalid bLength: 0]
            [Message: Invalid bLength: 0]
            [Severity level: Error]
            [Group: Malformed]
    UNKNOWN DESCRIPTOR
        bLength: 0
    Invalid bLength: 0
        [Expert Info (Error/Malformed): Invalid bLength: 0]
            [Message: Invalid bLength: 0]
            [Severity level: Error]
            [Group: Malformed]
    UNKNOWN DESCRIPTOR
        bLength: 0
    Invalid bLength: 0
        [Expert Info (Error/Malformed): Invalid bLength: 0]
            [Message: Invalid bLength: 0]
            [Severity level: Error]
            [Group: Malformed]
    UNKNOWN DESCRIPTOR
        bLength: 0
    Invalid bLength: 0
        [Expert Info (Error/Malformed): Invalid bLength: 0]
            [Message: Invalid bLength: 0]
            [Severity level: Error]
            [Group: Malformed]
    UNKNOWN DESCRIPTOR
        bLength: 0
    Invalid bLength: 0
        [Expert Info (Error/Malformed): Invalid bLength: 0]
            [Message: Invalid bLength: 0]
            [Severity level: Error]
            [Group: Malformed]
    UNKNOWN DESCRIPTOR
        bLength: 9
        bDescriptorType: CONFIGURATION (2)
    INTERFACE DESCRIPTOR
        bLength: 9
        bDescriptorType: INTERFACE (4)
        bInterfaceNumber: 0
        bAlternateSetting: 0
        bNumEndpoints: 1
        bInterfaceClass: HID (0x03)
        bInterfaceSubClass: 0x00
        bInterfaceProtocol: 0x00
        iInterface: 0

No.     Time        Source                Destination           Protocol Info
    184 102.959432  host                  5.0                   USB      URB_CONTROL

Frame 184 (8 bytes on wire, 8 bytes captured)
    Arrival Time: Oct 10, 2010 12:56:07.389037000
    [Time delta from previous captured frame: 0.029824000 seconds]
    [Time delta from previous displayed frame: 0.029824000 seconds]
    [Time since reference or first frame: 102.959432000 seconds]
    Frame Number: 184
    Frame Length: 8 bytes
    Capture Length: 8 bytes
    [Frame is marked: False]
    [Protocols in frame: usb]
USB URB
    URB id: 0xffff88002c2fee40
    URB type: URB_SUBMIT ('S')
    URB transfer type: URB_CONTROL (2)
    Endpoint: 0x00
    Device: 5
    URB bus id: 1
    Device setup request: present (0)
    Data: present (0)
    URB status: Operation now in progress (-EINPROGRESS) (-115)
    URB length [bytes]: 0
    Data length [bytes]: 0
    [Response in: 185]
    [bInterfaceClass: HID (0x03)]
    URB setup
        bmRequestType: 0x21
            0... .... = Direction: Host-to-device
            .01. .... = Type: Class (0x01)
            ...0 0001 = Recipient: Interface (0x01)
    Application Data: 0A000000000000

No.     Time        Source                Destination           Protocol Info
    185 102.959740  5.0                   host                  USB      URB_CONTROL

Frame 185 (8 bytes on wire, 8 bytes captured)
    Arrival Time: Oct 10, 2010 12:56:07.389345000
    [Time delta from previous captured frame: 0.000308000 seconds]
    [Time delta from previous displayed frame: 0.000308000 seconds]
    [Time since reference or first frame: 102.959740000 seconds]
    Frame Number: 185
    Frame Length: 8 bytes
    Capture Length: 8 bytes
    [Frame is marked: False]
    [Protocols in frame: usb]
USB URB
    URB id: 0xffff88002c2fee40
    URB type: URB_COMPLETE ('C')
    URB transfer type: URB_CONTROL (2)
    Endpoint: 0x00
    Device: 5
    URB bus id: 1
    Device setup request: not present ('-')
    Data: not present ('>')
    URB status: Success (0)
    URB length [bytes]: 0
    Data length [bytes]: 0
    [Request in: 184]
    [Time from request: 0.000308000 seconds]
    [bInterfaceClass: HID (0x03)]

No.     Time        Source                Destination           Protocol Info
    186 102.968830  host                  5.0                   USB      GET DESCRIPTOR Request RPIPE[Packet size limited during capture]

Frame 186 (109 bytes on wire, 8 bytes captured)
    Arrival Time: Oct 10, 2010 12:56:07.398435000
    [Time delta from previous captured frame: 0.009090000 seconds]
    [Time delta from previous displayed frame: 0.009090000 seconds]
    [Time since reference or first frame: 102.968830000 seconds]
    Frame Number: 186
    Frame Length: 109 bytes
    Capture Length: 8 bytes
    [Frame is marked: False]
    [Protocols in frame: usb]
USB URB
    URB id: 0xffff88002c2fee40
    URB type: URB_SUBMIT ('S')
    URB transfer type: URB_CONTROL (2)
    Endpoint: 0x80
    Device: 5
    URB bus id: 1
    Device setup request: present (0)
    Data: not present ('<')
    URB status: Operation now in progress (-EINPROGRESS) (-115)
    URB length [bytes]: 101
    Data length [bytes]: 0
    [Response in: 187]
    [bInterfaceClass: HID (0x03)]
    URB setup
        bmRequestType: 0x81
            1... .... = Direction: Device-to-host
            .00. .... = Type: Standard (0x00)
            ...0 0001 = Recipient: Interface (0x01)
        bRequest: GET DESCRIPTOR (6)
        Descriptor Index: 0x00
        bDescriptorType: RPIPE (34)
        Language Id: no language specified (0x0000)
        wLength: 101
[Packet size limited during capture: USB truncated]

No.     Time        Source                Destination           Protocol Info
    187 102.970239  5.0                   host                  USB      GET DESCRIPTOR Response RPIPE

Frame 187 (45 bytes on wire, 45 bytes captured)
    Arrival Time: Oct 10, 2010 12:56:07.399844000
    [Time delta from previous captured frame: 0.001409000 seconds]
    [Time delta from previous displayed frame: 0.001409000 seconds]
    [Time since reference or first frame: 102.970239000 seconds]
    Frame Number: 187
    Frame Length: 45 bytes
    Capture Length: 45 bytes
    [Frame is marked: False]
    [Protocols in frame: usb]
USB URB
    URB id: 0xffff88002c2fee40
    URB type: URB_COMPLETE ('C')
    URB transfer type: URB_CONTROL (2)
    Endpoint: 0x80
    Device: 5
    URB bus id: 1
    Device setup request: not present ('-')
    Data: present (0)
    URB status: Success (0)
    URB length [bytes]: 37
    Data length [bytes]: 37
    [Request in: 186]
    [Time from request: 0.001409000 seconds]
    [bInterfaceClass: HID (0x03)]
    GET DESCRIPTOR data

No.     Time        Source                Destination           Protocol Info
    188 *REF*       host                  5.1                   USB      URB_INTERRUPT[Packet size limited during capture]

Frame 188 (16 bytes on wire, 8 bytes captured)
    Arrival Time: Oct 10, 2010 12:56:07.432176000
    [Time delta from previous captured frame: 0.032332000 seconds]
    [Time delta from previous displayed frame: 0.032332000 seconds]
    [Time since reference or first frame: 0.000000000 seconds]
    [This is a Time Reference frame]
    Frame Number: 188
    Frame Length: 16 bytes
    Capture Length: 8 bytes
    [Frame is marked: False]
    [Protocols in frame: usb]
USB URB
    URB id: 0xffff88002c2fee40
    URB type: URB_SUBMIT ('S')
    URB transfer type: URB_INTERRUPT (1)
    Endpoint: 0x81
    Device: 5
    URB bus id: 1
    Device setup request: not present ('-')
    Data: not present ('<')
    URB status: Operation now in progress (-EINPROGRESS) (-115)
    URB length [bytes]: 8
    Data length [bytes]: 0
    [Response in: 219]
[Packet size limited during capture: USB truncated]

No.     Time        Source                Destination           Protocol Info
    217 82.385672   host                  5.0                   USB      URB_CONTROL

Frame 217 (16 bytes on wire, 16 bytes captured)
    Arrival Time: Oct 10, 2010 12:57:29.817848000
    [Time delta from previous captured frame: 59.173223000 seconds]
    [Time delta from previous displayed frame: 82.385672000 seconds]
    [Time since reference or first frame: 82.385672000 seconds]
    Frame Number: 217
    Frame Length: 16 bytes
    Capture Length: 16 bytes
    [Frame is marked: False]
    [Protocols in frame: usb]
USB URB
    URB id: 0xffff880026024600
    URB type: URB_SUBMIT ('S')
    URB transfer type: URB_CONTROL (2)
    Endpoint: 0x00
    Device: 5
    URB bus id: 1
    Device setup request: present (0)
    Data: present (0)
    URB status: Operation now in progress (-EINPROGRESS) (-115)
    URB length [bytes]: 8
    Data length [bytes]: 8
    [Response in: 218]
    [bInterfaceClass: HID (0x03)]
    URB setup
        bmRequestType: 0x21
            0... .... = Direction: Host-to-device
            .01. .... = Type: Class (0x01)
            ...0 0001 = Recipient: Interface (0x01)
    Application Data: 090002000008000000000000000000

No.     Time        Source                Destination           Protocol Info
    218 82.386305   5.0                   host                  USB      URB_CONTROL[Packet size limited during capture]

Frame 218 (16 bytes on wire, 8 bytes captured)
    Arrival Time: Oct 10, 2010 12:57:29.818481000
    [Time delta from previous captured frame: 0.000633000 seconds]
    [Time delta from previous displayed frame: 0.000633000 seconds]
    [Time since reference or first frame: 82.386305000 seconds]
    Frame Number: 218
    Frame Length: 16 bytes
    Capture Length: 8 bytes
    [Frame is marked: False]
    [Protocols in frame: usb]
USB URB
    URB id: 0xffff880026024600
    URB type: URB_COMPLETE ('C')
    URB transfer type: URB_CONTROL (2)
    Endpoint: 0x00
    Device: 5
    URB bus id: 1
    Device setup request: not present ('-')
    Data: not present ('>')
    URB status: Success (0)
    URB length [bytes]: 8
    Data length [bytes]: 0
    [Request in: 217]
    [Time from request: 0.000633000 seconds]
    [bInterfaceClass: HID (0x03)]
[Packet size limited during capture: USB truncated]

No.     Time        Source                Destination           Protocol Info
    219 82.394183   5.1                   host                  USB      URB_INTERRUPT

Frame 219 (16 bytes on wire, 16 bytes captured)
    Arrival Time: Oct 10, 2010 12:57:29.826359000
    [Time delta from previous captured frame: 0.007878000 seconds]
    [Time delta from previous displayed frame: 0.007878000 seconds]
    [Time since reference or first frame: 82.394183000 seconds]
    Frame Number: 219
    Frame Length: 16 bytes
    Capture Length: 16 bytes
    [Frame is marked: False]
    [Protocols in frame: usb]
USB URB
    URB id: 0xffff88002c2fee40
    URB type: URB_COMPLETE ('C')
    URB transfer type: URB_INTERRUPT (1)
    Endpoint: 0x81
    Device: 5
    URB bus id: 1
    Device setup request: not present ('-')
    Data: present (0)
    URB status: Success (0)
    URB length [bytes]: 8
    Data length [bytes]: 8
    [Request in: 188]
    [Time from request: 82.394183000 seconds]
    Application Data: 0800000000000000

No.     Time        Source                Destination           Protocol Info
    220 82.405650   host                  5.1                   USB      URB_INTERRUPT[Packet size limited during capture]

Frame 220 (16 bytes on wire, 8 bytes captured)
    Arrival Time: Oct 10, 2010 12:57:29.837826000
    [Time delta from previous captured frame: 0.011467000 seconds]
    [Time delta from previous displayed frame: 0.011467000 seconds]
    [Time since reference or first frame: 82.405650000 seconds]
    Frame Number: 220
    Frame Length: 16 bytes
    Capture Length: 8 bytes
    [Frame is marked: False]
    [Protocols in frame: usb]
USB URB
    URB id: 0xffff88002c2f1540
    URB type: URB_SUBMIT ('S')
    URB transfer type: URB_INTERRUPT (1)
    Endpoint: 0x81
    Device: 5
    URB bus id: 1
    Device setup request: not present ('-')
    Data: not present ('<')
    URB status: Operation now in progress (-EINPROGRESS) (-115)
    URB length [bytes]: 8
    Data length [bytes]: 0
    [Response in: 223]
[Packet size limited during capture: USB truncated]

No.     Time        Source                Destination           Protocol Info
    221 82.408835   host                  5.0                   USB      URB_CONTROL

Frame 221 (16 bytes on wire, 16 bytes captured)
    Arrival Time: Oct 10, 2010 12:57:29.841011000
    [Time delta from previous captured frame: 0.003185000 seconds]
    [Time delta from previous displayed frame: 0.003185000 seconds]
    [Time since reference or first frame: 82.408835000 seconds]
    Frame Number: 221
    Frame Length: 16 bytes
    Capture Length: 16 bytes
    [Frame is marked: False]
    [Protocols in frame: usb]
USB URB
    URB id: 0xffff88002c2f1f00
    URB type: URB_SUBMIT ('S')
    URB transfer type: URB_CONTROL (2)
    Endpoint: 0x00
    Device: 5
    URB bus id: 1
    Device setup request: present (0)
    Data: present (0)
    URB status: Operation now in progress (-EINPROGRESS) (-115)
    URB length [bytes]: 8
    Data length [bytes]: 8
    [Response in: 222]
    [bInterfaceClass: HID (0x03)]
    URB setup
        bmRequestType: 0x21
            0... .... = Direction: Host-to-device
            .01. .... = Type: Class (0x01)
            ...0 0001 = Recipient: Interface (0x01)
    Application Data: 090002000008000000000000000000

No.     Time        Source                Destination           Protocol Info
    222 82.409432   5.0                   host                  USB      URB_CONTROL[Packet size limited during capture]

Frame 222 (16 bytes on wire, 8 bytes captured)
    Arrival Time: Oct 10, 2010 12:57:29.841608000
    [Time delta from previous captured frame: 0.000597000 seconds]
    [Time delta from previous displayed frame: 0.000597000 seconds]
    [Time since reference or first frame: 82.409432000 seconds]
    Frame Number: 222
    Frame Length: 16 bytes
    Capture Length: 8 bytes
    [Frame is marked: True]
    [Protocols in frame: usb]
USB URB
    URB id: 0xffff88002c2f1f00
    URB type: URB_COMPLETE ('C')
    URB transfer type: URB_CONTROL (2)
    Endpoint: 0x00
    Device: 5
    URB bus id: 1
    Device setup request: not present ('-')
    Data: not present ('>')
    URB status: Success (0)
    URB length [bytes]: 8
    Data length [bytes]: 0
    [Request in: 221]
    [Time from request: 0.000597000 seconds]
    [bInterfaceClass: HID (0x03)]
[Packet size limited during capture: USB truncated]
